{"authorization":"RESEARCH_ONLY_NOT_SHADOW_PAPER_OR_LIVE","availability":{"eligible_time":"WEEK_ENDING_SUNDAY_PLUS_3_CALENDAR_DAYS_AT_00_00_UTC","factor_valid_hours":168,"non_sunday_action":"REJECT_SOURCE","publication_lag_calendar_days":3,"window_days":28},"bindings":{"base_runner":{"path":"research/btc_dra_reversal_confirmed_exit_v2c.py","sha256":"7b17f1acc591b571ed238b5d8141d0bc2b2ebd4bde860273db23c17398e05e37"},"capacity_runner":{"path":"research/btc_dra_equal_capital_capacity_v1.py","sha256":"0736afdfe22f514adf5596a883ad94dd3713ec0ef542b167dc92db03e1fd619f"},"hypothesis":{"path":"research_pipeline/examples/dra-bitcoin-fee-pressure-entry-admission-v1.hypothesis.json","sha256":"0eea27a1bc708545235ad191dc3dc507137213f25e207f97a782911c6f1c2f11"},"manifest_schema":{"path":"research_pipeline/btc-dra-bitcoin-fee-pressure-entry-admission-manifest.v1.schema.json","sha256":"428c6cbc7f7ee48bb134bed01fdcc50f5adbcf840bcce28944b5edb3c4c3f2d0"},"normalized_source":{"path":".research-state/experiments/dra-bitcoin-fee-pressure-entry-admission-historical-v1/inputs/coinmetrics-btc-fee-pressure-2018-2024.csv","sha256":"6dd78283ff476ddca7bed52bf01ad76a6b49d6bf1125c9e360ad95aa5787feed"},"primary_prior":{"path":"research_pipeline/examples/dra-bitcoin-fee-pressure-primary-prior.v1.json","sha256":"1ccfdc2da50a4ae019b5ca3d08c565abcb0dc51452aff9f63415487217b2617c"},"raw_source_response":{"path":".research-state/experiments/dra-bitcoin-fee-pressure-entry-admission-historical-v1/inputs/coinmetrics-btc-fee-pressure-2018-2024-raw.json","sha256":"42275b99afb4d2cefdd39a5dacd089f02e52d69689b3a23069d12e9c4332c772"},"reused_economic_runner":{"path":"research/btc_dra_cftc_tff_entry_admission_historical_v1.py","sha256":"fdde75be9efe7b9dfe065c46429de75594da88c4d2360b0c7891ee467649635b"},"runner":{"path":"research/btc_dra_bitcoin_fee_pressure_entry_admission_historical_v1.py","sha256":"9c3b9ccf72bc30c1b1d4bc46d3c641543f6f2f1bdaebfa5b7f3be36af6a858b8"},"source_bundle":{"path":".research-state/experiments/dra-bitcoin-fee-pressure-entry-admission-historical-v1/inputs/coinmetrics-source-bundle.json","sha256":"17c2af2888356f531e20b6f23aab40647fa44997a0fb6fcfeb6ecbc1eabb8eb6"},"source_metadata":{"path":"research_pipeline/examples/coinmetrics-btc-fee-pressure-daily-2018-2024.v1.source.json","sha256":"03cf5e5c5f18c19597bcd5fd61024158ef25369da806f32820c632457281d17d"},"source_probe":{"path":"research/coinmetrics_btc_fee_pressure_source_probe.cjs","sha256":"91eded6fb5bcb86f6a6b394a074acde0efd991cc98c653f891d83e3f5be6a117"}},"dataset":{"canonical_sha256":"e436a5a2b093365886464dd3e471cc5cd55c54bd2c06ceaa898ac218c45436dd","rows":52608},"document_type":"BTC_DRA_BITCOIN_FEE_PRESSURE_ENTRY_ADMISSION_MANIFEST_V1","economics":{"fee_rate":"0.0010","initial_equity_usdt":"250","slippage_rate":"0.0005","slot_capacity_usdt":"240"},"experiment_id":"dra-bitcoin-fee-pressure-entry-admission-historical-v1","factor":{"admission_rule":"ADMIT_PARENT_SIGNAL_ONLY_WHEN_CURRENT_28D_MEAN_FEETOTNTV_GT_IMMEDIATELY_PRECEDING_28D_MEAN","factor_identity":"COIN_METRICS_BTC_FEETOTNTV_STRICT_POSITIVE_ADJACENT_28D_GROWTH_168H_V1","formula":"current_28d_mean_feetotntv-prior_nonoverlapping_28d_mean_feetotntv","negative_action":"HOLD_CASH","positive_action":"ADMIT","series_id":"FeeTotNtv","zero_action":"HOLD_CASH"},"gate_set":"BTC_DRA_CFTC_TFF_HISTORICAL_ENTRY_ADMISSION_GATES_V1","oos_access":"DENY","parent_strategy":"BTC_DRA_V1","schema_version":"1","selection_cutoff":"2025-01-01T00:00:00","source":{"first_date":"2018-01-01","last_date":"2024-12-31","metric":"FeeTotNtv","normalized_bytes":59333,"present_vintage":true,"publisher":"Coin Metrics Community API","rows":2557,"weekly_aggregation":"SEVEN_COMPLETE_DAYS_MONDAY_THROUGH_SUNDAY"},"windows":{"annual_folds":["2020","2021","2022","2023","2024"],"design":{"end_exclusive":"2023-01-01T00:00:00","start_inclusive":"2020-01-01T00:00:00"},"outcome_horizon_hours":168,"validation":{"end_exclusive":"2025-01-01T00:00:00","start_inclusive":"2023-01-01T00:00:00"}}}
